{
  "schema_version": "0.1",
  "created_at": "2026-06-23T00:00:00+08:00",
  "raw_text_only": true,
  "notes": "Example only. Do not put real API keys in a committed config.",
  "providers": [
    {
      "enabled": true,
      "provider": "azure_speech_tts",
      "display_name": "Azure Speech TTS Xiaoxiao",
      "model": "azure-neural-tts",
      "voice": "zh-CN-XiaoxiaoNeural",
      "sample_rate": 24000,
      "audio_format": "wav",
      "auth": {
        "api_key_env": "AZURE_SPEECH_KEY"
      },
      "request": {
        "region_env": "AZURE_SPEECH_REGION"
      },
      "policy": {
        "raw_text_only": true,
        "external_frontend": false,
        "llm_rewrite": false,
        "ssml": false,
        "manual_text_fix": false
      },
      "notes": "Fill provider-specific fields locally or use tools/api_config_builder.html."
    }
  ]
}
